{
  "$schema": "https://schema.reportportal.io/manifest.schema.json",
  "manifestVersion": "1.0",
  "id": "app-name",
  "name": "App Name",
  "version": "1.0.0",
  "description": "A description of the app",
  "group": "other",
  "developer": {
    "name": "Publisher Name",
    "website": "https://example.com"
  },
  "documentation": "http://example.com/docs",
  "license": "Apache-2.0",
  "icon": {
    "type": "url",
    "content": "https://cdn.example.com/path/to/icon.jpg"
  },
  "baseUrl": "https://example.com",
  "permissions": {
    "scopes": []
  },
  "modules": {
    "projectPages": [
      {
        "slug": "my-project-page",
        "name": "My Project Page",
        "title": "Project Page",
        "menuOrder": 25,
        "url": "/index",
        "icon": {
          "type": "url",
          "content": "https://cdn.example.com/path/to/icon.png"
        }
      },
      {
        "slug": "my-other-project-page",
        "name": "My Other Project Page",
        "url": "/other.html",
        "icon": {
          "type": "base64",
          "content": "data:image/png;base64,AsdAD="
        }
      },
      {
        "slug": "my-third-project-page",
        "name": "My Third Project Page",
        "url": "/third.html",
        "icon": {
          "type": "svg",
          "content": "<svg>...</svg>"
        }
      }
    ],
    "adminPages": [
      {
        "slug": "my-admin-page",
        "name": "My Admin Page",
        "title": "Admin Page",
        "menuOrder": 50,
        "url": "/admin",
        "icon": {
          "type": "url",
          "content": "https://cdn.example.com/path/to/admin-icon.png"
        }
      }
    ]
  }
}
